{
  "$defs": {
    "capability": {
      "additionalProperties": false,
      "properties": {
        "environments": {
          "items": {
            "minLength": 1,
            "type": "string"
          },
          "type": "array",
          "uniqueItems": true
        },
        "side_effect": {
          "enum": [
            "read-only",
            "local-write",
            "remote-write",
            "destructive"
          ]
        },
        "source": {
          "$ref": "#/$defs/source"
        },
        "status": {
          "enum": [
            "supported",
            "unsupported"
          ]
        }
      },
      "required": [
        "status",
        "side_effect",
        "environments",
        "source"
      ],
      "type": "object"
    },
    "source": {
      "additionalProperties": false,
      "allOf": [
        {
          "if": {
            "properties": {
              "layer": {
                "enum": [
                  "generic",
                  "context"
                ]
              }
            },
            "required": [
              "layer"
            ]
          },
          "then": {
            "properties": {
              "ref": {
                "pattern": "^[0-9a-f]{40}$"
              }
            }
          }
        },
        {
          "if": {
            "properties": {
              "layer": {
                "const": "project"
              }
            },
            "required": [
              "layer"
            ]
          },
          "then": {
            "properties": {
              "ref": {
                "pattern": "^(?:HEAD|[0-9a-f]{40})$"
              }
            }
          }
        }
      ],
      "properties": {
        "checksum": {
          "pattern": "^sha256:[0-9a-f]{64}$",
          "type": "string"
        },
        "layer": {
          "enum": [
            "generic",
            "context",
            "project"
          ]
        },
        "path": {
          "minLength": 1,
          "pattern": "^(?!/)(?!.*(?:^|/)\\.\\.(?:/|$)).+$",
          "type": "string"
        },
        "ref": {
          "minLength": 1,
          "type": "string"
        }
      },
      "required": [
        "layer",
        "ref",
        "checksum",
        "path"
      ],
      "type": "object"
    }
  },
  "$id": "https://github.com/smarterworkerai/agentic-delivery/skills/adw/adw-core/assets/mise/v1/schemas/adw-task-manifest.schema.json",
  "$schema": "https://json-schema.org/draft/2020-12/schema",
  "additionalProperties": false,
  "properties": {
    "capabilities": {
      "additionalProperties": false,
      "properties": {
        "adw:build": {
          "$ref": "#/$defs/capability",
          "properties": {
            "side_effect": {
              "const": "local-write"
            }
          }
        },
        "adw:check": {
          "$ref": "#/$defs/capability",
          "properties": {
            "side_effect": {
              "const": "read-only"
            },
            "status": {
              "const": "supported"
            }
          }
        },
        "adw:context:check": {
          "$ref": "#/$defs/capability",
          "properties": {
            "side_effect": {
              "const": "read-only"
            }
          }
        },
        "adw:context:sync": {
          "$ref": "#/$defs/capability",
          "properties": {
            "side_effect": {
              "const": "local-write"
            }
          }
        },
        "adw:deploy:apply": {
          "$ref": "#/$defs/capability",
          "properties": {
            "side_effect": {
              "const": "remote-write"
            }
          }
        },
        "adw:deploy:config:apply": {
          "$ref": "#/$defs/capability",
          "properties": {
            "side_effect": {
              "const": "remote-write"
            }
          }
        },
        "adw:deploy:config:plan": {
          "$ref": "#/$defs/capability",
          "properties": {
            "side_effect": {
              "const": "read-only"
            }
          }
        },
        "adw:deploy:config:pull": {
          "$ref": "#/$defs/capability",
          "properties": {
            "side_effect": {
              "const": "local-write"
            }
          }
        },
        "adw:deploy:status": {
          "$ref": "#/$defs/capability",
          "properties": {
            "side_effect": {
              "const": "read-only"
            }
          }
        },
        "adw:describe": {
          "$ref": "#/$defs/capability",
          "properties": {
            "side_effect": {
              "const": "read-only"
            },
            "status": {
              "const": "supported"
            }
          }
        },
        "adw:e2e": {
          "$ref": "#/$defs/capability",
          "properties": {
            "side_effect": {
              "const": "remote-write"
            }
          }
        },
        "adw:health": {
          "$ref": "#/$defs/capability",
          "properties": {
            "side_effect": {
              "const": "read-only"
            }
          }
        },
        "adw:hotfix:apply": {
          "$ref": "#/$defs/capability",
          "properties": {
            "side_effect": {
              "const": "remote-write"
            }
          }
        },
        "adw:install": {
          "$ref": "#/$defs/capability",
          "properties": {
            "side_effect": {
              "const": "local-write"
            }
          }
        },
        "adw:lint": {
          "$ref": "#/$defs/capability",
          "properties": {
            "side_effect": {
              "const": "local-write"
            }
          }
        },
        "adw:readiness": {
          "$ref": "#/$defs/capability",
          "properties": {
            "side_effect": {
              "const": "read-only"
            }
          }
        },
        "adw:static-analysis": {
          "$ref": "#/$defs/capability",
          "properties": {
            "side_effect": {
              "const": "local-write"
            }
          }
        },
        "adw:test:integration": {
          "$ref": "#/$defs/capability",
          "properties": {
            "side_effect": {
              "const": "local-write"
            }
          }
        },
        "adw:test:unit": {
          "$ref": "#/$defs/capability",
          "properties": {
            "side_effect": {
              "const": "local-write"
            }
          }
        },
        "adw:validate-deployment": {
          "$ref": "#/$defs/capability",
          "properties": {
            "side_effect": {
              "const": "remote-write"
            }
          }
        },
        "adw:verify:full": {
          "$ref": "#/$defs/capability",
          "properties": {
            "side_effect": {
              "const": "local-write"
            }
          }
        },
        "adw:verify:minimal": {
          "$ref": "#/$defs/capability",
          "properties": {
            "side_effect": {
              "const": "local-write"
            }
          }
        }
      },
      "required": [
        "adw:describe",
        "adw:check",
        "adw:install",
        "adw:build",
        "adw:lint",
        "adw:static-analysis",
        "adw:test:unit",
        "adw:test:integration",
        "adw:verify:minimal",
        "adw:verify:full",
        "adw:deploy:config:pull",
        "adw:deploy:config:plan",
        "adw:deploy:config:apply",
        "adw:deploy:apply",
        "adw:deploy:status",
        "adw:health",
        "adw:readiness",
        "adw:e2e",
        "adw:validate-deployment",
        "adw:hotfix:apply",
        "adw:context:check",
        "adw:context:sync"
      ],
      "type": "object"
    },
    "contract": {
      "additionalProperties": false,
      "properties": {
        "compatible": {
          "pattern": "^>=[0-9]+\\.[0-9]+\\.[0-9]+,<[0-9]+\\.[0-9]+\\.[0-9]+$",
          "type": "string"
        },
        "name": {
          "const": "adw-mise-task-contract"
        },
        "version": {
          "const": "1.0.0"
        }
      },
      "required": [
        "name",
        "version",
        "compatible"
      ],
      "type": "object"
    },
    "environments": {
      "items": {
        "minLength": 1,
        "type": "string"
      },
      "type": "array",
      "uniqueItems": true
    },
    "evidence": {
      "additionalProperties": false,
      "properties": {
        "root": {
          "const": ".hermes/evidence"
        }
      },
      "required": [
        "root"
      ],
      "type": "object"
    },
    "project": {
      "additionalProperties": false,
      "properties": {
        "id": {
          "minLength": 1,
          "type": "string"
        }
      },
      "required": [
        "id"
      ],
      "type": "object"
    },
    "required_secret_env": {
      "items": {
        "pattern": "^[A-Z][A-Z0-9_]*$",
        "type": "string"
      },
      "type": "array",
      "uniqueItems": true
    },
    "schema_version": {
      "const": "1.0.0"
    },
    "sources": {
      "items": {
        "$ref": "#/$defs/source"
      },
      "minItems": 1,
      "type": "array"
    },
    "verification": {
      "additionalProperties": false,
      "properties": {
        "full": {
          "items": {
            "enum": [
              "adw:build",
              "adw:lint",
              "adw:static-analysis",
              "adw:test:integration",
              "adw:test:unit"
            ]
          },
          "minItems": 1,
          "type": "array",
          "uniqueItems": true
        },
        "minimal": {
          "anyOf": [
            {
              "contains": {
                "const": "adw:build"
              }
            },
            {
              "contains": {
                "const": "adw:test:unit"
              }
            },
            {
              "contains": {
                "const": "adw:test:integration"
              }
            }
          ],
          "items": {
            "enum": [
              "adw:build",
              "adw:lint",
              "adw:static-analysis",
              "adw:test:integration",
              "adw:test:unit"
            ]
          },
          "minItems": 1,
          "type": "array",
          "uniqueItems": true
        }
      },
      "required": [
        "minimal",
        "full"
      ],
      "type": "object"
    },
    "context_freshness": {
      "type": "object",
      "additionalProperties": false,
      "properties": {
        "policy": {
          "enum": [
            "advisory",
            "require-current-compatible"
          ]
        },
        "index": {
          "type": "object",
          "additionalProperties": false,
          "properties": {
            "path": {
              "type": "string",
              "minLength": 1,
              "pattern": "^(?!/)(?!.*(?:^|/)\\.\\.(?:/|$)).+$"
            },
            "checksum": {
              "type": "string",
              "pattern": "^sha256:[0-9a-f]{64}$"
            }
          },
          "required": [
            "path",
            "checksum"
          ]
        }
      },
      "required": [
        "policy",
        "index"
      ]
    }
  },
  "required": [
    "schema_version",
    "contract",
    "project",
    "evidence",
    "environments",
    "sources",
    "capabilities",
    "verification"
  ],
  "title": "ADW mise task manifest",
  "type": "object"
}
