{
  "capabilities": {
    "adw:build": {
      "environments": [],
      "side_effect": "local-write",
      "source": {
        "checksum": "sha256:bbbbbbbbbbbbbbbbbbbbbbbbbbbbbbbbbbbbbbbbbbbbbbbbbbbbbbbbbbbbbbbb",
        "layer": "project",
        "path": "mise-helper/tasks.toml",
        "ref": "HEAD"
      },
      "status": "supported"
    },
    "adw:check": {
      "environments": [],
      "side_effect": "read-only",
      "source": {
        "checksum": "sha256:aaaaaaaaaaaaaaaaaaaaaaaaaaaaaaaaaaaaaaaaaaaaaaaaaaaaaaaaaaaaaaaa",
        "layer": "generic",
        "path": "mise-helper/vendor/agentic-delivery/tasks.toml",
        "ref": "1111111111111111111111111111111111111111"
      },
      "status": "supported"
    },
    "adw:context:check": {
      "environments": [],
      "side_effect": "read-only",
      "source": {
        "checksum": "sha256:aaaaaaaaaaaaaaaaaaaaaaaaaaaaaaaaaaaaaaaaaaaaaaaaaaaaaaaaaaaaaaaa",
        "layer": "generic",
        "path": "mise-helper/vendor/agentic-delivery/tasks.toml",
        "ref": "1111111111111111111111111111111111111111"
      },
      "status": "unsupported"
    },
    "adw:context:sync": {
      "environments": [],
      "side_effect": "local-write",
      "source": {
        "checksum": "sha256:aaaaaaaaaaaaaaaaaaaaaaaaaaaaaaaaaaaaaaaaaaaaaaaaaaaaaaaaaaaaaaaa",
        "layer": "generic",
        "path": "mise-helper/vendor/agentic-delivery/tasks.toml",
        "ref": "1111111111111111111111111111111111111111"
      },
      "status": "unsupported"
    },
    "adw:deploy:apply": {
      "environments": [
        "review"
      ],
      "side_effect": "remote-write",
      "source": {
        "checksum": "sha256:bbbbbbbbbbbbbbbbbbbbbbbbbbbbbbbbbbbbbbbbbbbbbbbbbbbbbbbbbbbbbbbb",
        "layer": "project",
        "path": "mise-helper/tasks.toml",
        "ref": "HEAD"
      },
      "status": "supported"
    },
    "adw:deploy:config:apply": {
      "environments": [
        "review"
      ],
      "side_effect": "remote-write",
      "source": {
        "checksum": "sha256:bbbbbbbbbbbbbbbbbbbbbbbbbbbbbbbbbbbbbbbbbbbbbbbbbbbbbbbbbbbbbbbb",
        "layer": "project",
        "path": "mise-helper/tasks.toml",
        "ref": "HEAD"
      },
      "status": "supported"
    },
    "adw:deploy:config:plan": {
      "environments": [
        "review"
      ],
      "side_effect": "read-only",
      "source": {
        "checksum": "sha256:bbbbbbbbbbbbbbbbbbbbbbbbbbbbbbbbbbbbbbbbbbbbbbbbbbbbbbbbbbbbbbbb",
        "layer": "project",
        "path": "mise-helper/tasks.toml",
        "ref": "HEAD"
      },
      "status": "supported"
    },
    "adw:deploy:config:pull": {
      "environments": [
        "review"
      ],
      "side_effect": "local-write",
      "source": {
        "checksum": "sha256:bbbbbbbbbbbbbbbbbbbbbbbbbbbbbbbbbbbbbbbbbbbbbbbbbbbbbbbbbbbbbbbb",
        "layer": "project",
        "path": "mise-helper/tasks.toml",
        "ref": "HEAD"
      },
      "status": "supported"
    },
    "adw:deploy:status": {
      "environments": [
        "review"
      ],
      "side_effect": "read-only",
      "source": {
        "checksum": "sha256:bbbbbbbbbbbbbbbbbbbbbbbbbbbbbbbbbbbbbbbbbbbbbbbbbbbbbbbbbbbbbbbb",
        "layer": "project",
        "path": "mise-helper/tasks.toml",
        "ref": "HEAD"
      },
      "status": "supported"
    },
    "adw:describe": {
      "environments": [],
      "side_effect": "read-only",
      "source": {
        "checksum": "sha256:aaaaaaaaaaaaaaaaaaaaaaaaaaaaaaaaaaaaaaaaaaaaaaaaaaaaaaaaaaaaaaaa",
        "layer": "generic",
        "path": "mise-helper/vendor/agentic-delivery/tasks.toml",
        "ref": "1111111111111111111111111111111111111111"
      },
      "status": "supported"
    },
    "adw:e2e": {
      "environments": [
        "review"
      ],
      "side_effect": "remote-write",
      "source": {
        "checksum": "sha256:bbbbbbbbbbbbbbbbbbbbbbbbbbbbbbbbbbbbbbbbbbbbbbbbbbbbbbbbbbbbbbbb",
        "layer": "project",
        "path": "mise-helper/tasks.toml",
        "ref": "HEAD"
      },
      "status": "supported"
    },
    "adw:health": {
      "environments": [
        "review"
      ],
      "side_effect": "read-only",
      "source": {
        "checksum": "sha256:bbbbbbbbbbbbbbbbbbbbbbbbbbbbbbbbbbbbbbbbbbbbbbbbbbbbbbbbbbbbbbbb",
        "layer": "project",
        "path": "mise-helper/tasks.toml",
        "ref": "HEAD"
      },
      "status": "supported"
    },
    "adw:hotfix:apply": {
      "environments": [
        "review"
      ],
      "side_effect": "remote-write",
      "source": {
        "checksum": "sha256:bbbbbbbbbbbbbbbbbbbbbbbbbbbbbbbbbbbbbbbbbbbbbbbbbbbbbbbbbbbbbbbb",
        "layer": "project",
        "path": "mise-helper/tasks.toml",
        "ref": "HEAD"
      },
      "status": "supported"
    },
    "adw:install": {
      "environments": [],
      "side_effect": "local-write",
      "source": {
        "checksum": "sha256:bbbbbbbbbbbbbbbbbbbbbbbbbbbbbbbbbbbbbbbbbbbbbbbbbbbbbbbbbbbbbbbb",
        "layer": "project",
        "path": "mise-helper/tasks.toml",
        "ref": "HEAD"
      },
      "status": "supported"
    },
    "adw:lint": {
      "environments": [],
      "side_effect": "local-write",
      "source": {
        "checksum": "sha256:bbbbbbbbbbbbbbbbbbbbbbbbbbbbbbbbbbbbbbbbbbbbbbbbbbbbbbbbbbbbbbbb",
        "layer": "project",
        "path": "mise-helper/tasks.toml",
        "ref": "HEAD"
      },
      "status": "supported"
    },
    "adw:readiness": {
      "environments": [
        "review"
      ],
      "side_effect": "read-only",
      "source": {
        "checksum": "sha256:bbbbbbbbbbbbbbbbbbbbbbbbbbbbbbbbbbbbbbbbbbbbbbbbbbbbbbbbbbbbbbbb",
        "layer": "project",
        "path": "mise-helper/tasks.toml",
        "ref": "HEAD"
      },
      "status": "supported"
    },
    "adw:static-analysis": {
      "environments": [],
      "side_effect": "local-write",
      "source": {
        "checksum": "sha256:bbbbbbbbbbbbbbbbbbbbbbbbbbbbbbbbbbbbbbbbbbbbbbbbbbbbbbbbbbbbbbbb",
        "layer": "project",
        "path": "mise-helper/tasks.toml",
        "ref": "HEAD"
      },
      "status": "supported"
    },
    "adw:test:integration": {
      "environments": [],
      "side_effect": "local-write",
      "source": {
        "checksum": "sha256:bbbbbbbbbbbbbbbbbbbbbbbbbbbbbbbbbbbbbbbbbbbbbbbbbbbbbbbbbbbbbbbb",
        "layer": "project",
        "path": "mise-helper/tasks.toml",
        "ref": "HEAD"
      },
      "status": "supported"
    },
    "adw:test:unit": {
      "environments": [],
      "side_effect": "local-write",
      "source": {
        "checksum": "sha256:bbbbbbbbbbbbbbbbbbbbbbbbbbbbbbbbbbbbbbbbbbbbbbbbbbbbbbbbbbbbbbbb",
        "layer": "project",
        "path": "mise-helper/tasks.toml",
        "ref": "HEAD"
      },
      "status": "supported"
    },
    "adw:validate-deployment": {
      "environments": [
        "review"
      ],
      "side_effect": "remote-write",
      "source": {
        "checksum": "sha256:bbbbbbbbbbbbbbbbbbbbbbbbbbbbbbbbbbbbbbbbbbbbbbbbbbbbbbbbbbbbbbbb",
        "layer": "project",
        "path": "mise-helper/tasks.toml",
        "ref": "HEAD"
      },
      "status": "supported"
    },
    "adw:verify:full": {
      "environments": [],
      "side_effect": "local-write",
      "source": {
        "checksum": "sha256:bbbbbbbbbbbbbbbbbbbbbbbbbbbbbbbbbbbbbbbbbbbbbbbbbbbbbbbbbbbbbbbb",
        "layer": "project",
        "path": "mise-helper/tasks.toml",
        "ref": "HEAD"
      },
      "status": "supported"
    },
    "adw:verify:minimal": {
      "environments": [],
      "side_effect": "local-write",
      "source": {
        "checksum": "sha256:bbbbbbbbbbbbbbbbbbbbbbbbbbbbbbbbbbbbbbbbbbbbbbbbbbbbbbbbbbbbbbbb",
        "layer": "project",
        "path": "mise-helper/tasks.toml",
        "ref": "HEAD"
      },
      "status": "supported"
    }
  },
  "contract": {
    "compatible": ">=1.0.0,<2.0.0",
    "name": "adw-mise-task-contract",
    "version": "1.0.0"
  },
  "environments": [
    "review"
  ],
  "evidence": {
    "root": ".hermes/evidence"
  },
  "project": {
    "id": "fixture/service"
  },
  "required_secret_env": [],
  "schema_version": "1.0.0",
  "sources": [
    {
      "checksum": "sha256:aaaaaaaaaaaaaaaaaaaaaaaaaaaaaaaaaaaaaaaaaaaaaaaaaaaaaaaaaaaaaaaa",
      "layer": "generic",
      "path": "mise-helper/vendor/agentic-delivery/tasks.toml",
      "ref": "1111111111111111111111111111111111111111"
    },
    {
      "checksum": "sha256:bbbbbbbbbbbbbbbbbbbbbbbbbbbbbbbbbbbbbbbbbbbbbbbbbbbbbbbbbbbbbbbb",
      "layer": "project",
      "path": "mise-helper/tasks.toml",
      "ref": "HEAD"
    }
  ],
  "verification": {
    "full": [
      "adw:build",
      "adw:lint",
      "adw:static-analysis",
      "adw:test:unit",
      "adw:test:integration"
    ],
    "minimal": [
      "adw:build",
      "adw:test:unit"
    ]
  }
}
